{
  "$schema": "https://json-schema.org/draft/2020-12/schema",
  "$id": "https://lumyn.dev/schemas/decision_record.v0.schema.json",
  "title": "Lumyn DecisionRecord (v0)",
  "type": "object",
  "additionalProperties": false,
  "required": [
    "schema_version",
    "decision_id",
    "created_at",
    "request",
    "policy",
    "verdict",
    "reason_codes",
    "matched_rules",
    "risk_signals",
    "determinism"
  ],
  "properties": {
    "schema_version": { "type": "string", "const": "decision_record.v0" },
    "decision_id": { "type": "string", "description": "ULID recommended.", "minLength": 10 },
    "created_at": { "type": "string", "format": "date-time" },
    "trace": {
      "type": "object",
      "additionalProperties": false,
      "properties": {
        "correlation_id": { "type": "string" },
        "span_id": { "type": "string" }
      }
    },
    "request": { "$ref": "#/$defs/decision_request_v0" },
    "policy": {
      "type": "object",
      "additionalProperties": false,
      "required": ["policy_id", "policy_version", "policy_hash", "mode"],
      "properties": {
        "policy_id": { "type": "string" },
        "policy_version": { "type": "string" },
        "policy_hash": { "type": "string", "pattern": "^sha256:[0-9a-f]{64}$" },
        "mode": { "type": "string", "enum": ["enforce", "advisory"] }
      }
    },
    "verdict": { "type": "string", "enum": ["TRUST", "ABSTAIN", "ESCALATE", "QUERY"] },
    "reason_codes": {
      "type": "array",
      "minItems": 1,
      "items": { "type": "string" },
      "description": "Stable machine-readable explanations."
    },
    "matched_rules": {
      "type": "array",
      "items": {
        "type": "object",
        "additionalProperties": false,
        "required": ["rule_id", "stage", "effect"],
        "properties": {
          "rule_id": { "type": "string" },
          "stage": {
            "type": "string",
            "enum": ["REQUIREMENTS", "HARD_BLOCKS", "ESCALATIONS", "TRUST_PATHS", "DEFAULT"]
          },
          "effect": { "type": "string", "enum": ["TRUST", "ABSTAIN", "ESCALATE", "QUERY", "NOOP"] },
          "reason_codes": { "type": "array", "items": { "type": "string" }, "default": [] }
        }
      },
      "default": []
    },
    "risk_signals": {
      "type": "object",
      "additionalProperties": false,
      "required": ["uncertainty_score", "failure_similarity"],
      "properties": {
        "uncertainty_score": { "type": "number", "minimum": 0, "maximum": 1 },
        "failure_similarity": {
          "type": "object",
          "additionalProperties": false,
          "required": ["score", "top_k"],
          "properties": {
            "score": { "type": "number", "minimum": 0, "maximum": 1 },
            "top_k": {
              "type": "array",
              "items": {
                "type": "object",
                "additionalProperties": false,
                "required": ["memory_id", "label", "score"],
                "properties": {
                  "memory_id": { "type": "string" },
                  "label": { "type": "string", "enum": ["failure", "success", "near_miss"] },
                  "score": { "type": "number", "minimum": 0, "maximum": 1 },
                  "summary": { "type": "string" }
                }
              },
              "default": []
            }
          }
        },
        "ood_score": { "type": "number", "minimum": 0, "maximum": 1 },
        "drift_flag": { "type": "boolean" }
      }
    },
    "queries": {
      "type": "array",
      "items": {
        "type": "object",
        "additionalProperties": false,
        "required": ["field", "question"],
        "properties": {
          "field": { "type": "string" },
          "question": { "type": "string" }
        }
      },
      "default": []
    },
    "obligations": {
      "type": "array",
      "items": { "type": "object", "additionalProperties": true },
      "default": []
    },
    "explanation": {
      "type": "object",
      "additionalProperties": false,
      "properties": {
        "summary": { "type": "string" },
        "details": { "type": "string" }
      }
    },
    "decision_event_log": {
      "type": "array",
      "items": {
        "type": "object",
        "additionalProperties": false,
        "required": ["event_id", "at", "type"],
        "properties": {
          "event_id": { "type": "string" },
          "at": { "type": "string", "format": "date-time" },
          "type": { "type": "string", "enum": ["outcome", "label", "note", "override"] },
          "data": { "type": "object", "additionalProperties": true }
        }
      },
      "default": []
    },
    "links": {
      "type": "object",
      "additionalProperties": false,
      "properties": {
        "context_id": { "type": "string" },
        "proof_id": { "type": "string" }
      }
    },
    "determinism": {
      "type": "object",
      "additionalProperties": false,
      "required": ["engine_version", "evaluation_order", "inputs_digest"],
      "properties": {
        "engine_version": { "type": "string" },
        "evaluation_order": {
          "type": "array",
          "items": {
            "type": "string",
            "enum": ["REQUIREMENTS", "HARD_BLOCKS", "ESCALATIONS", "TRUST_PATHS", "DEFAULT"]
          }
        },
        "inputs_digest": { "type": "string", "pattern": "^sha256:[0-9a-f]{64}$" },
        "memory_snapshot": {
          "type": "string",
          "description": "Identifier for the memory state used (implementation-defined)."
        }
      }
    },
    "extensions": { "type": "object", "additionalProperties": true, "default": {} }
  },
  "$defs": {
    "decision_request_v0": {
      "$schema": "https://json-schema.org/draft/2020-12/schema",
      "$id": "https://lumyn.dev/schemas/decision_request.v0.schema.json",
      "title": "Lumyn DecisionRequest (v0)",
      "type": "object",
      "additionalProperties": false,
      "required": ["schema_version", "subject", "action", "context"],
      "properties": {
        "schema_version": { "type": "string", "const": "decision_request.v0" },
        "request_id": { "type": "string" },
        "trace": {
          "type": "object",
          "additionalProperties": false,
          "properties": { "correlation_id": { "type": "string" }, "span_id": { "type": "string" } }
        },
        "tenant": {
          "type": "object",
          "additionalProperties": false,
          "required": ["tenant_id"],
          "properties": {
            "tenant_id": { "type": "string", "minLength": 1 },
            "environment": { "type": "string", "enum": ["dev", "staging", "prod"] }
          }
        },
        "subject": {
          "type": "object",
          "additionalProperties": false,
          "required": ["type", "id"],
          "properties": {
            "type": { "type": "string", "enum": ["service", "agent", "user", "job"] },
            "id": { "type": "string", "minLength": 1 },
            "tenant_id": { "type": "string" },
            "ip": { "type": "string" },
            "user_agent": { "type": "string" },
            "roles": { "type": "array", "items": { "type": "string" }, "default": [] }
          }
        },
        "action": {
          "type": "object",
          "additionalProperties": false,
          "required": ["type", "intent"],
          "properties": {
            "type": { "type": "string", "pattern": "^[a-z0-9]+(\\.[a-z0-9_]+)+$" },
            "intent": { "type": "string", "minLength": 1 },
            "target": {
              "type": "object",
              "additionalProperties": false,
              "properties": { "system": { "type": "string" }, "resource_type": { "type": "string" }, "resource_id": { "type": "string" } }
            },
            "amount": {
              "type": "object",
              "additionalProperties": false,
              "properties": { "value": { "type": "number" }, "currency": { "type": "string", "minLength": 3, "maxLength": 3 } }
            },
            "tags": { "type": "array", "items": { "type": "string" }, "default": [] }
          }
        },
        "evidence": { "type": "object", "additionalProperties": true, "default": {} },
        "context": {
          "type": "object",
          "additionalProperties": false,
          "required": ["mode", "digest"],
          "properties": {
            "mode": { "type": "string", "enum": ["digest_only", "inline", "reference"] },
            "digest": { "type": "string", "pattern": "^sha256:[0-9a-f]{64}$" },
            "ref": {
              "type": "object",
              "additionalProperties": false,
              "required": ["kind", "id"],
              "properties": { "kind": { "type": "string" }, "id": { "type": "string" }, "uri": { "type": "string" } }
            },
            "inline": { "type": "object", "additionalProperties": true },
            "redaction": {
              "type": "object",
              "additionalProperties": false,
              "properties": { "profile": { "type": "string" }, "fields_removed": { "type": "array", "items": { "type": "string" }, "default": [] } }
            }
          },
          "allOf": [
            { "if": { "properties": { "mode": { "const": "inline" } } }, "then": { "required": ["inline"] } },
            { "if": { "properties": { "mode": { "const": "reference" } } }, "then": { "required": ["ref"] } }
          ]
        },
        "policy": {
          "type": "object",
          "additionalProperties": false,
          "properties": { "policy_id": { "type": "string" }, "policy_version": { "type": "string" }, "mode": { "type": "string", "enum": ["enforce", "advisory"] } }
        },
        "hints": {
          "type": "object",
          "additionalProperties": false,
          "properties": { "mode": { "type": "string", "enum": ["enforce", "advisory"] }, "dry_run": { "type": "boolean", "default": false } }
        },
        "extensions": { "type": "object", "additionalProperties": true, "default": {} }
      }
    }
  }
}
